{
  "description": "Dependency map for tasks in the ROWS system. Tracks which tasks depend on which other tasks.",
  "schema": {
    "task_id": "string — the dependent task",
    "depends_on": ["array of task IDs this task depends on"],
    "blocked_by": ["array of task IDs currently blocking this task"],
    "blocks": ["array of task IDs this task blocks"]
  },
  "dependencies": [],
  "last_updated": "2026-05-06T13:50:00-04:00"
}
